id,spanish,example_es,example_en,mood,tense
480,llevarse bien,Se llevarán bien en cuanto se conozcan mejor.,They will get along once they know each other better.,Indicativo,Futuro
481,el sitio web,Compré las entradas en el sitio web oficial.,I bought the tickets on the official website.,,
482,la responsabilidad,Cuidar del perro es tu responsabilidad.,Taking care of the dog is your responsibility.,,
484,hablador,Mi tío es muy hablador en las reuniones familiares.,My uncle is very talkative at family gatherings.,,
485,el punto de vista,"Respeto tu punto de vista, aunque no esté de acuerdo.","I respect your point of view, even though I don't agree.",,
486,el archivo,Adjunté el archivo en el correo.,I attached the file to the email.,,
487,llegar tarde,Llegarás tarde si no sales ahora.,You'll be late if you don't leave now.,Indicativo,Futuro
488,el reportaje,Vimos un reportaje sobre el cambio climático.,We watched a report about climate change.,,
489,el juego de mesa,Jugamos un juego de mesa después de cenar.,We played a board game after dinner.,,
490,el entrevistador,El entrevistador hizo preguntas muy difíciles.,The interviewer asked very difficult questions.,,
491,la estrategia,El equipo cambió su estrategia en el segundo tiempo.,The team changed its strategy in the second half.,,
492,la deforestación,La deforestación amenaza a muchas especies animales.,Deforestation threatens many animal species.,,
493,lujoso,Se hospedaron en un hotel lujoso durante la luna de miel.,They stayed at a luxurious hotel during their honeymoon.,,
494,la infancia,Pasó su infancia en un pequeño pueblo.,He spent his childhood in a small town.,,
495,la crítica,El libro recibió muy buena crítica.,The book received very good reviews.,,
496,el invitado,El invitado de honor llegó tarde a la cena.,The guest of honor arrived late to the dinner.,,
497,disfrutar de,Disfrutarás de un descanso merecido.,You will enjoy a well-deserved rest.,Indicativo,Futuro
498,el consumo,El consumo de energía aumenta en verano.,Energy consumption increases in summer.,,
499,escalar montañas,Escalaremos montañas en nuestro próximo viaje.,We will climb mountains on our next trip.,Indicativo,Futuro
500,el recurso natural,El agua es un recurso natural muy valioso.,Water is a very valuable natural resource.,,
501,realista,Tenemos que ser realistas sobre el plazo del proyecto.,We have to be realistic about the project deadline.,,
502,estar a dieta,Estarás a dieta si quieres bajar de peso rápido.,You'll be on a diet if you want to lose weight quickly.,Indicativo,Futuro
503,ir de vacaciones,Iremos de vacaciones en agosto.,We will go on vacation in August.,Indicativo,Futuro
504,hacer un viaje,Harás un viaje increíble el próximo mes.,You will take an incredible trip next month.,Indicativo,Futuro
505,pasarlo mal,Lo pasarás mal si no estudias para el examen.,You'll have a bad time if you don't study for the exam.,Indicativo,Futuro
506,sostenible,Buscan un modelo de desarrollo más sostenible.,They are looking for a more sustainable development model.,,
507,el reportero,El reportero cubrió la noticia en vivo.,The reporter covered the news live.,,
508,ganarse la vida,Me ganaré la vida haciendo lo que amo.,I will earn a living doing what I love.,Indicativo,Futuro
509,la manifestación,Miles de personas participaron en la manifestación.,Thousands of people took part in the demonstration.,,
510,el usuario,La aplicación tiene más de un millón de usuarios.,The app has more than a million users.,,
511,la sanidad,El gobierno invirtió más dinero en la sanidad pública.,The government invested more money in public healthcare.,,
512,el desempleo,El desempleo bajó durante el último trimestre.,Unemployment dropped during the last quarter.,,
513,el equilibrio,Es importante mantener el equilibrio entre trabajo y vida personal.,It's important to maintain a balance between work and personal life.,,
514,el edificio de apartamentos,Viven en un edificio de apartamentos cerca del centro.,They live in an apartment building near downtown.,,
515,llevarse mal,Se llevarán mal si no resuelven sus diferencias.,They will get along badly if they don't resolve their differences.,Indicativo,Futuro
516,el beneficio,La empresa tuvo grandes beneficios este trimestre.,The company had large profits this quarter.,,
517,la ecologista,La ecologista organizó una protesta contra la tala de árboles.,The environmentalist organized a protest against tree cutting.,,
518,la autoestima,Hacer deporte mejoró mucho su autoestima.,Playing sports greatly improved her self-esteem.,,
519,nutritivo,Intentamos preparar comidas nutritivas para los niños.,We try to prepare nutritious meals for the kids.,,
520,la diversión,El parque de diversiones es pura diversión para los niños.,The amusement park is pure fun for the kids.,,
521,apasionado,Es un apasionado de la música clásica.,He's passionate about classical music.,,
522,comentar,Comentaré tu propuesta con el equipo mañana.,I will discuss your proposal with the team tomorrow.,Indicativo,Futuro
523,el medicamento,Tienes que tomar este medicamento tres veces al día.,You have to take this medicine three times a day.,,
524,el cambio climático,El cambio climático afecta a todo el planeta.,Climate change affects the whole planet.,,
525,el agricultor,El agricultor cosecha maíz cada otoño.,The farmer harvests corn every fall.,,
526,el funcionario,Trabaja como funcionario en el ayuntamiento.,He works as a civil servant at the city council.,,
527,equilibrado,Es importante llevar una dieta equilibrada.,It's important to have a balanced diet.,,
528,el enfado,Se le pasó el enfado después de hablar con ella.,His anger went away after talking with her.,,
529,el petróleo,El precio del petróleo subió esta semana.,The price of oil went up this week.,,
530,la publicidad,Trabaja en publicidad para una marca de ropa.,She works in advertising for a clothing brand.,,
531,la entrega,La entrega del paquete tardó una semana.,The package delivery took a week.,,
532,la ciencia ficción,Le encantan las películas de ciencia ficción.,He loves science fiction movies.,,
533,la computación,Estudia computación en la universidad.,She studies computer science at university.,,
534,el rescate,El equipo de rescate llegó rápidamente al lugar del accidente.,The rescue team arrived quickly at the accident site.,,
535,el envase,Reciclamos el envase de plástico después de usarlo.,We recycle the plastic container after using it.,,
536,la informática,Trabaja en el departamento de informática de la empresa.,He works in the company's computing department.,,
537,el requisito,Cumplir con este requisito es obligatorio para el puesto.,Meeting this requirement is mandatory for the position.,,
538,el campamento,Los niños fueron a un campamento de verano.,The kids went to a summer camp.,,
539,el consumidor,La empresa escucha las quejas del consumidor.,The company listens to consumer complaints.,,
540,elaborar,Elaboraremos una nueva estrategia el próximo trimestre.,We will develop a new strategy next quarter.,Indicativo,Futuro
541,la aspirante,La aspirante tuvo una entrevista excelente.,The applicant had an excellent interview.,,
542,el ascenso,Recibió un ascenso después de cinco años en la empresa.,He received a promotion after five years at the company.,,
543,el descubrimiento,El descubrimiento del nuevo fósil sorprendió a los científicos.,The discovery of the new fossil surprised scientists.,,
544,el retraso,Hubo un retraso de dos horas en el vuelo.,There was a two-hour delay on the flight.,,
545,la indígena,La comunidad indígena conserva sus tradiciones antiguas.,The indigenous community preserves its ancient traditions.,,
546,el árbitro,El árbitro sacó tarjeta roja al jugador.,The referee showed the player a red card.,,
547,el diseñador,El diseñador presentó su nueva colección de ropa.,The designer presented his new clothing collection.,,
548,el préstamo,Pidieron un préstamo al banco para comprar la casa.,They took out a loan from the bank to buy the house.,,
549,desigualdad,La desigualdad económica sigue siendo un gran problema.,Economic inequality remains a big problem.,,
550,el ayuntamiento,El ayuntamiento aprobó el nuevo parque.,The city council approved the new park.,,
551,pedir prestado,Pedirás prestado el proyector para la presentación.,You will borrow the projector for the presentation.,Indicativo,Futuro
552,el malentendido,Todo fue un malentendido entre nosotros.,It was all a misunderstanding between us.,,
553,empatar,Empatarán si nadie anota en el último minuto.,They will tie if no one scores in the last minute.,Indicativo,Futuro
554,presumido,Es demasiado presumido con su nuevo coche.,He's too conceited about his new car.,,
555,la inundación,La inundación destruyó varias casas del pueblo.,The flood destroyed several houses in the town.,,
556,la sabiduría,Sus palabras reflejan mucha sabiduría.,His words reflect great wisdom.,,
557,el calentamiento global,El calentamiento global está derritiendo los glaciares.,Global warming is melting the glaciers.,,
558,adelgazar,Adelgazarás si sigues esta dieta.,You will lose weight if you follow this diet.,Indicativo,Futuro
559,aplaudir,Aplaudirán con entusiasmo la presentación.,They will applaud the presentation enthusiastically.,Indicativo,Futuro
560,el aficionado,Es un gran aficionado del fútbol.,He's a huge soccer fan.,,
561,la sequía,La sequía afectó las cosechas de este año.,The drought affected this year's harvests.,,
562,el título,Todavía no decidí el título de mi tesis.,I still haven't decided on the title of my thesis.,,
563,el océano,El océano Pacífico es el más grande del mundo.,The Pacific Ocean is the largest in the world.,,
564,adolescencia,"Durante la adolescencia, los cambios físicos son constantes.","During adolescence, physical changes are constant.",,
565,grave,El paciente sufrió una lesión grave en el accidente.,The patient suffered a serious injury in the accident.,,
